uid,Text,DV_present,Abuse_present,Sentiment,Hashtags,
1,Why didn’t I leave my abuser? Because he emotionally blackmailed me into staying. Because he made me aware of the power he had over me and that leaving was never an option. That if I left I will live to regret it. Dare to ask me again why couldn’t I leave? #WhyIStayed,Positive,OFF,Negative,#WhyIStayed,
2,"Pastors, we have to work to repent of this narrative. Encouraging a person to stay in an abusive relationship because of your beliefs about divorce is, plainly put, evil. #whyistayed",Negative,OFF,Neutral,#WhyIStayed,
3,I had no money a 3 month old baby and he controlled money I was scared my baby would go hungry #whyistayed #domesticabuse #coercivecontrol,Positive,OFF,Negative,#whyistayed #domesticabuse #coercivecontrol,
4,"#whyistayed my husband and his mother threatened, ""These are OUR children. You will never get them. WE CAN BUY ANY JUDGE IN THE COUNTRY."" 
They temporarily succeed at the lower courts. Every single high court judge to date has shown impartiality, repeatedly granting me custody",Negative,NOT,Negative,#whyistayed,
5,"Because I was shit scared of him. 2 things; I’d die trying, or I’d loose the kids and I’d take my own life. The only way to protect my babies from him, was to be with him. Believe her. Always, believe her.",Positive,OFF,Negative,#WhyIStayed,
6,"It’s not related to pogo, but if you’re interested to know more about me, then please read. #WhyIStayed #WhyILeft https://facebook.com/kaito.nolan.9/posts/221051611965214",Negative,NOT,Neutral,#WhyIStayed ,
7,#WhyIStayed created space for empathizing with intimate partner violence survivors when mainstream media maligned them. Digital Activist of the Day  @bevtgooden bravely told her story and allowed others to tell theirs with this important #HashtagActivism http://hashtagactivismbook.com,Negative,NOT,Neutral,#WhyIStayed ,
8,I thought I had no friends and nobody would help or support me if I left. #WhyIStayed,Positive,NOT,Negative,,
9,"""I found myself in the position I never expected to be in, echoing the words of countless women undone by the violence of the men in their lives: 'But I still love him.'"" #DomesticAbuse #WhyIStayed",Positive,OFF,Negative,#DomesticAbuse #WhyIStayed,
10,you don’t deserve to be frightened when you see a phone message from your ex  YOU DO NOT DESERVE TO HAVE YOUR WHOLE LIFE MEASURED AGAINST MAKING THIS MAN HAPPY OR MAD You will find way more love on the other side of that wall. #whyistayed #whyileft,Negative,OFF,Negative,#whyistayed #whyileft,
11,And to imagine that an adult was just there comfortably filming.Let's hope this was used as evidence to lock him away.,Negative,NOT,Neutral,.#WhyIStayed  #WhyILeft  #domesticviolence #DomesticAbuse,
12,I left an abusive relationship. What drove me to leave wasn’t necessarily the abuse. It wasn’t even that he was sleeping with (at least 5) other girls. It was that he was telling other girls he loved them.,Negative,NOT,Negative,#emotionalabuse #DomesticViolence #whyILeft #love #damage #survivor,
13,I guess it was the beatings that made me wise,Positive,OFF,Negative,#WhyILeft,
14,Understanding what domestic abuse is and surviving it are only a part of the journey. What does it look like to survive the mental/emotional aftermath and learn to thrive? ,Negative,NOT,Neutral,#breakingthesilence #survivor #dvsurvivor,
15,"So the person who got to abuse me in every way w/o any REAL consequences decided to roll up on me going for a walk. For over 20 years I've had to keep an vigilant eye n no matter how I've tried to deal w it, cops/agencies etc... he just gets too",Positive,OFF,Negative,#DVsurvivor #dvvictim,
16,Domestic Violence is a like a Sour patch kids commercial. First he hits you and then he's buying you something expensive. ,Positive,NOT,Neutral,#FightAgainstDV,
17,Leaving an abusive relationship is no easy task. Often times an abusive partner will use any tactic necessary  to manipulate you into staying.,Negative,OFF,Negative,"
#Native #Abuseisnotok #Indigenous #DV #Native #AlaskaNative",
18,"Many times when I pointed out that things like jealousy, possessiveness, degrading and demeaning talk, misogyny, control & power dynamics underly ",Positive,OFF,Negative,#dv,
19,Abuse rarely begins with boulders  thrown at your head. It's little pebbles tossed at your feet... to see what you will do.,Negative,NOT,Neutral,#Abusive #protection,
20,"""Travel to the isolated town of #Abalone Lake &amp; experience the rush of first love, the pain of #domesticviolence, &amp; the gravity of a decision that changes everyone's lives forever. https://t.co/DRnWv5Zun5 https://t.co/SI2OxUdAlN""",Negative,OFF,Negative,#NewAdult #WomensHistoryMonth #MeToo #secondchances #survivor #ChickLit,
21,"If you are already at the stage where your husband is violent in his words or actions, things are not likely to just magically improve on their own.",Positive,OFF,Negative,#domesticviolence #abuse #domesticabuse #controlling #control #husband #AskAmanda,
22,"I recall going to the police re being stalked and concerned for my safety, in 1997. I was informed they would not act until I was actually assaulted. By the time I landed in ",Positive,OFF,Negative,,
23,"When I was in the depths of my abusive marriage, I used to read this over &amp; over while hiding in my bathroom. I donâ€™t know who wrote it  but thank you.",Positive,OFF,Negative,#DomesticViolence ,
24,"As a woman who has been sexually harassed in every job I've ever had, I feel physically sick at Salmond standing for election",Negative,OFF,Negative,#MeToo,
26,"Here are a few questions I have heard for women in the past six months.
1. ""Usko depression hai, breakup hua kya uska?""
2. ""Tum poora din laptop k samne kya kaam karti ho?""
3. ""Aise kaam karogi toh family ko kaise dekhogi?""",Negative,OFF,Negative,,
27,"4. ""Lockdown mein moti ho gayi ho, aise kaun shaadi karega?""
5. ""Ghar pe itni short shorts Matt pehna karo, bhai bhi hai""
6. ""Delhi tak official trips pe akele gaadi lekar nahi jana, kuch bhi ho sakta hai.""
#sexism
#patriarchy",Negative,OFF,Negative,"#sexism
#patriarchy",
28,"7. ""Har baat pe argue kyu karne lagti ho, aage k ghar walon ko yeh acha nai lagega.""
8. ""Badon ki izzat karo, vo experienced hain, tumhara acha hi chahte hain.""
9. ""Khana tum banao na, yeh Mera kam nahi hai.""
#Feminism 
#WomenOfCourage 
#womenempowerment 
#Womensutra",Negative,OFF,Negative,"#Feminism 
#WomenOfCourage 
#womenempowerment 
#Womensutra",
29,"Kya ajab chutiya aadmi. Matlab daru piyoge to abuse jhelna padega, ye to deal pakki hai. Kahan kahan se chale aate hain. #ramgopalverma #sexism #wtf",Positive,OFF,Negative,#ramgopalverma #sexism #wtf,
30,"If you love a girl: ""Mujhe yeh ladki chahiye kyunki mujhe iske saath zindagi beetani hai"". If you have lust on a girl: ""Bhai, bistar garam karne ke liye bas yeh laundiya mil jaaye"". #sexism #leftistan  @AuratMarchKHI #AuratMarch2020 #AuratAzadiMarch2020",Positive,OFF,Negative,"#sexism #leftistan 
@AuratMarchKHI
 #AuratMarch2020 #AuratAzadiMarch2020",
31,Leaving costs money; many survivors do not have the financial means to leave the abusive relationship!  It’s important to support agencies that can provide shelter to survivors fleeing abusive relationships. It’s on all of us to #SupportSurvivors #WhyIStayed #DomesticViolence,Negative,NOT,Neutral,"#SupportSurvivors
#WhyIStayed #DomesticViolence",
32,Happy divorceaversary to me!!! 1 year ago I thought I was experiencing the worst thing that would ever happen to me. Turns out it was the best bc it got me away from an abusive toxic human who had me so controlled I couldn't even see it. #survivorspeaks #loveshouldnthurt,Negative,NOT,Positive,#survivorspeaks #loveshouldnthurt,
33,"In honor of #DomesticViolenceAwarenessMonth, I'll be posting daily, things my abusive ex used to say to me: #SurvivorSpeaks #DVAM2018  1. ""Why do you care if I listen in on your phone conversations or read your mail? What are you trying to hide from me?!""",Positive,OFF,Negative,#DomesticViolenceAwarenessMonth#SurvivorSpeaks #DVAM2018,
34,"For #DomesticViolenceAwarenessMonth, I'm posting daily; things my abusive ex used to say to me: #SurvivorSpeaks #DVAM2018  30. ""I checked the odometer before you left. I know you're lying to me about where you went.""",Negative,NOT,Negative,#DomesticViolenceAwarenessMonth#SurvivorSpeaks #DVAM2018,
35,"For #DomesticViolenceAwarenessMonth, I'm posting daily; things my abusive ex used to say to me: #SurvivorSpeaks #DVAM2018 23. ""You're crazy! No one will believe you!""",Negative,NOT,Negative,#DomesticViolenceAwarenessMonth#SurvivorSpeaks #DVAM2018,
36,"For #DomesticViolenceAwarenessMonth, I'm posting daily; things my abusive ex used to say to me: #SurvivorSpeaks #DVAM2018 28. ""If you leave me, I'll make sure you end up with nothing.""",Positive,OFF,Negative,#DomesticViolenceAwarenessMonth#SurvivorSpeaks #DVAM2018,
37,"For #DomesticViolenceAwarenessMonth, I'm posting daily; things my abusive ex used to say to me: #SurvivorSpeaks #DVAM2018 26. ""You need to put on weight. You have the hips of a teenage boy."" *I was the same weight/shape as when we married - it was about control*",Positive,OFF,Negative,#DomesticViolenceAwarenessMonth#SurvivorSpeaks #DVAM2018,
38,"For #DomesticViolenceAwarenessMonth, I'm posting daily; things my abusive ex used to say to me: #SurvivorSpeaks #DVAM2018 25. ""Quit writing negative things about me in your journal!"" * My journal was private/hidden. He said the same thing about my poetry. I quit writing.",Negative,NOT,Negative,#DomesticViolenceAwarenessMonth#SurvivorSpeaks #DVAM2018,
39,"For #DomesticViolenceAwarenessMonth, I'm posting daily, things my abusive ex used to say to me: #SurvivorSpeaks #DVAM2018  5. ""Do you know how lucky you are to be married to me?! Do you know how many women would kill to be in your place?!""",Negative,OFF,Negative,#DomesticViolenceAwarenessMonth#SurvivorSpeaks #DVAM2018,
40,"For #DomesticViolenceAwarenessMonth, I'm posting daily, things my abusive ex used to say to me: #SurvivorSpeaks #DVAM2018 *after being offered a job at an upscale boutique* 4. ""You can't have another job! Your job is here taking care of the house, me and the kids!""",Positive,OFF,Negative,#DomesticViolenceAwarenessMonth#SurvivorSpeaks #DVAM2018,
41,"For #DomesticViolenceAwarenessMonth, I'm posting daily, things my abusive ex used to say to me: #SurvivorSpeaks #DVAM2018   6. ""I wouldn't have hit you if you hadn't gotten in my face!""",Positive,OFF,Negative,#DomesticViolenceAwarenessMonth#SurvivorSpeaks #DVAM2018,
42,"For #DomesticViolenceAwarenessMonth, I'm posting daily; things my abusive ex used to say to me: #SurvivorSpeaks #DVAM2018   9. ""I wouldn't get upset, if I didn't love you.""",Negative,NOT,Negative,#DomesticViolenceAwarenessMonth#SurvivorSpeaks #DVAM2018,
43,"For #DomesticViolenceAwarenessMonth, I'm posting daily; things my abusive ex used to say to me: #SurvivorSpeaks #DVAM2018 11. ""Next time you leave me it will be in a body bag.""",Positive,OFF,Negative,#DomesticViolenceAwarenessMonth#SurvivorSpeaks #DVAM2018,
44,"For #DomesticViolenceAwarenessMonth, I'm posting daily; things my abusive ex used to say to me: #SurvivorSpeaks #DVAM2018 15. ""You're not seeing things clearly, because of your depression.""",Positive,OFF,Negative,#DomesticViolenceAwarenessMonth#SurvivorSpeaks #DVAM2018,
45,"For #DomesticViolenceAwarenessMonth, I'm posting daily; things my abusive ex used to say to me: #SurvivorSpeaks #DVAM2018 29. ""You can't rape your wife.""",Positive,OFF,Negative,#DomesticViolenceAwarenessMonth#SurvivorSpeaks #DVAM2018,
46,"For #DomesticViolenceAwarenessMonth, I'm posting daily; things my abusive ex used to say to me: #SurvivorSpeaks #DVAM2018 14. ""I never said that. You hear what you want to hear.""",Positive,NOT,Negative,#DomesticViolenceAwarenessMonth#SurvivorSpeaks #DVAM2018,
47,"For #DomesticViolenceAwarenessMonth, I'm posting daily; things my abusive ex used to say to me: #SurvivorSpeaks #DVAM2018 24. ""Quit crying! I barely touched you!""",Positive,OFF,Negative,#DomesticViolenceAwarenessMonth#SurvivorSpeaks #DVAM2018,
48,"For #DomesticViolenceAwarenessMonth, I'm posting daily; things my abusive ex used to say to me: #SurvivorSpeaks #DVAM2018 12. ""You're too sensitive.""",Positive,NOT,Negative,#DomesticViolenceAwarenessMonth#SurvivorSpeaks #DVAM2018,
49,"For #DomesticViolenceAwarenessMonth, I'm posting daily; things my abusive ex used to say to me: #SurvivorSpeaks #DVAM2018 20. ""I don't want to live, if I'm not with you and the kids.""",Negative,NOT,Positive,#DomesticViolenceAwarenessMonth#SurvivorSpeaks #DVAM2018,
50,"Hey guys, I wanted to share with everyone, even those I have yet to meet (hey!) a tragedy that has happened recently in my family. Not to spread negativity or to make you frown along with the weather today but to shed light on #DomesticViolence #DomesticViolenceAwarenessMonth",Negative,NOT,Negative,,
51,My cousin Samantha was shot 5 times by her ex-boyfriend who then committed suicide after.  She is still clinging to the hospital beds at the ICU but showing fast improvement!!!!! God is goodFolded hands and won’t he do it. My baby is alive and strong.,Positive,OFF,Negative,,
52,"She currently can only show facial expressions and move her arms, other than that my baby girl can not feel her legs or walk, she cannot speak, and she cannot breathe on her own still..but we will continue to pray everyday, I encourage everyone to do so as well, please",Negative,NOT,Negative,,
53,"Intimate partner violence doesn’t just affect adults, but also any children that are exposed to violence. Studies show that children who have witnessed #DomesticViolence have trauma similar to that of a soldier who has witnessed war.  #DomesticViolenceAwarenessMonth",Negative,NOT,Neutral,,
54,"#SurvivorSpeaks I escaped 2 abusive marriages. It wasn't easy but I did it. Started over, twice. 
You are not alone. Reach out if you need to and any moment you are able to safely. 
#DVWARRIOR",Positive,NOT,Positive,#SurvivorSpeaks #DVWARRIOR,
55,BC when a #SurvivorSpeaks we get a better idea of what control tactics look like. Patricia* tells about the text messages she would receive from her abuser demanding to know where she was. She says the impact on her schooling & work was overwhelming. #DVAM2018,Positive,NOT,Positive,#SurvivorSpeaks #DVAM2018,
56,"#SurvivorSpeaks: “He’s conditioned her into ignoring his flaws, trapped her into codependency, and tricked her into thinking it was all her idea.” #domesticviolence #dvam",Positive,NOT,Negative,#SurvivorSpeaks #domesticviolence #dvam,
57,"didn't 'just' survive an abusive relationship, I became a warrior because of it & I'll stand for those who don't have the strength 'til the day I don't wake up again.",Positive,NOT,Positive,#dvwarrior,
58,"""The amount of shame and helplessness I felt was so palpable. It took over everything. I wasn’t good enough for him; I was stupid and he was smart."" Tamara shares her story with us",Positive,NOT,Negative,#SurvivorStory #btsadv #DVWarrior,
59,"come to think of it, I was quite shaken by the incident. And ""he"" never saw himself in the wrong. < How long ago",Positive,NOT,Negative,,#DVWarrior
60,"Domestic violence isn't just about broken ribs, blackened eyes, and busted lips ... Domestic violence is about a broken spirit, broken self-esteem, broken self-worth, broken self-dignity & broken human rights.",Negative,NOT,Neutral,#DVFacts #SurvivorSpeaks,
61,"I can’t express how terrifying and traumatic being abused to where you almost feel death is, it sadness me that many of us have gone through this. I pray that she recovers and heals from this. Domestic violence is real, and needs to be talked about more",Positive,NOT,Negative,#SurvivorSpeaks,
62,"It took me years to heal, years to not feel afraid of the shadows that haunted me. I am surviving my trauma. Today I share my truth with you. Unashamed, honest and raw.",Positive,NOT,Negative,#survivorspeaks #ptsd #survivor,
63,#IAmNotOk because a police officer told me spousal rape wasn't rape. And walked away and let my abuser walk back into our house.,Positive,OFF,Negative,,#IAmNotOk
64,#IAmNotOk just tonight. I'm having flashbacks. I hear his booming voice screaming at me. I see him throwing dishes and whatever he can throw. I'm scared and panicking. I know I'm safe...but when will I understand that?,Positive,OFF,Negative,,#IAmNotOk
65,"I’ve been out of my abusive relationship for over a year now and I still instantly put my head down and hands at my sides when anyone yells in front of me. Alot of people don’t understand that once you finally leave, you still have a long ways to go. #iamnotOK",Positive,NOT,Negative,#iamnotOK,
66,"My dad hit me in the face, chased me through our house, hit my head against a radiator, tackled me to the ground and sat on me, pinning me to the ground and continued attacking me. This was in the span of 10 minutes and incited by me... working on homework. #Iamnotok",Positive,OFF,Negative,#Iamnotok,
67,I came home and was choked and kicked and tied up because I was “accused” of cheating. All I did was pick my drunk mother up from the casino cause she couldn’t drive home... #iamnotok #IAmNotOk,Positive,OFF,Negative,#Iamnotok,
68,#IAmNotOk because it’s been nearly two years since I was sexually assaulted on a night out and I still think about it everyday - I suffered PTSD and dropped out of uni whilst my attacker most likely lives his life guilt free,Positive,OFF,Negative,,
69,It has been happening to all the women in my family for more than 5 generations. Not anymore. And I am changing it for my daughters. Pt 2 #iamnotok,Negative,NOT,Positive,#iamnotok,
70,"I grew up in a home with domestic violence and i vowed no man would ever raise his hand to me.see, i was waiting for him to raise his hand when he made me feel unpretty, he wouldn’t hold my hand in public, in a long distance relationship,refused phone calls over 5minutes long",Positive,NOT,Negative,,
71,"Never a single compliment on anything I did, never appreciation...I was waiting for him to raise his hand to me because that’s the abuse I recognized, that I didn’t see him tear me up inside and #IAmNotOk with that",Positive,NOT,Negative,,
72,"#IAmNotOk because I normalized my abuser’s bad behavior. He often made up offensive aggressive lies about other women. He’d only stop if I agreed. He tried to distance me from my healthy female friendships. He was sure they were all crazy, jealous, unstable cunts who wanted him.",Positive,OFF,Negative,,
73,"As I hear people’s #iamnotok stories of domestic violence I remember my sexual exploitation. Men controlled, beat, and violated me and I did not have a voice to cry out. ",Positive,OFF,Negative,,
74,"My classmate #TiannaBaker was shot and killed Wednesday, March 24th 2021 by her ex boyfriend in a act of domestic violence. You were only 19year old and so beautiful. You were the sweetest girl ever. You did not deserve this. RIP TiannaBroken heart #StLouis",Positive,OFF,Negative,#domesticviolence,
75,Say know to this act.. #against #Domestic #violence,Negative,NOT,Positive,#domesticviolence,
76,Your voice is your superpower and no one should be able to take it away from you. #feldsteinfamilylaw #familylaw #familylawyer #divorcelawyer #divorce #speakyourtruth #positivemindset #divorcesupport #highconflictdivorce #narcissists #narcissisticabuse #toxicrelationships https://t.co/Uwmae0Y2Cs,Negative,NOT,Positive,#feldsteinfamilylaw #familylaw #familylawyer #divorcelawyer #divorce #speakyourtruth #positivemindset #divorcesupport #highconflictdivorce #narcissists #narcissisticabuse #toxicrelationships,
77,many people are going through #domestic & #gender based violence but are afraid to speak out so be your brothers keeper and stand up for such a person in our communities for a better community for all ,Negative,NOT,Negative,#domesticviolence #domestic #gender,
78,"""If I'm a woman ( in #scientology ) & my husband beats the crap out of me, I can't call the cops. Not b/c of issues with a being a woman reporting #DomesticViolence",Positive,OFF,Negative,#DomesticViolence #domestic #scientology,
79,"Deshaun Watson is the topic of every morning sports show, yet Chad Wheeler's attempted murder of his GF gets swept under the rug.. #MeToo has made it clear which type of men they're going after",Positive,OFF,Negative,#MeToo #domesticviolence,
80,"As a woman who has been sexually harassed in every job I've ever had, I feel physically sick at Salmond standing for election #MeToo",Positive,OFF,Negative,#MeToo #domesticviolence,
81,"Sudan is unsafe, unjust & unfair for women Flag of Sudan #MeTooSudan #MeToo",Negative,NOT,Negative,#MeToo #domesticviolence #MetooSudan,
82,"This is what happens with girls/women on traveling alone to Pakistan. The first harassment they face at immigration and then the process continues. This FIA officer harassed a 15 year old at Karachi airport, who was traveling alone from Bahrain to Pakistan. #MeToo",Positive,OFF,Negative,#MeToo,
83,#wednesdaythought #Metoo #Wednesdayvibe #auspoI #WednesdayMotivation #MotivationalQuotes #motivation Respecting gender is an old and obsolete concept..Respect person and not her gender. I can't respect a bad person because of her or his gender.,Negative,NOT,Positive,#wednesdaythought #Metoo #Wednesdayvibe #auspoI #WednesdayMotivation #MotivationalQuotes #motivation ,
84,"This rapist sexually assaulted ANOTHER woman prior to this case in 2017, and the white run court systems was on code with him then, and dismissed those charges.",Positive,OFF,Negative,#MeToo #domesticviolence,
85,"We are raising awareness on Sexual Harassment. In line with it, we are coming up with a campaign video. We are looking for people who would be interested in sharing their experiences to spread awareness! Get in touch with us! #EnKathai #MeToo #LottuLosku #VerraKathaigal",Negative,NOT,Positive,#EnKathai #MeToo #LottuLosku #VerraKathaigal,
86,"I was raped three times in the 70s, and up until the #MeToo movement blamed myself for not being able to fight them off.",Positive,NOT,Negative,#MeToo,
87,"Then he forces her to drink until she's legally drunk (0.08), thus nullifying the rape!"" What the fuck were they thinking of when their State Supreme Court ruled in favor of the most heinous act to woman, little girl, can be done.! #MeToo",Positive,OFF,Negative,#MeToo #domesticviolence,
88,"He would always have to explain to society that he was found not guilty of the sexual harassment or assault charges. In the eyes of many, that doesn’t signify innocence; some might even blame the system for ""allowing him to get away with it"".",Negative,OFF,Negative,#MeToo,
89,"Okay here I go, I got dateraped when I was 18, there wasen’t a word for it 30 years ago so I thought it was my fault #metoo",Positive,OFF,Neutral,#MeToo ,
90,"Women have been fighting for years on end for an equal place in this society, but no one is listening or doing anything about the level of sexual abuse, harassment and violence that we have to endure on a daily basis. It feels NORMAL for me to be scared to go shopping, walk down the street to a friend's house, walk to work in the dark, or simply exist. It's automatic for me to carry keys in my hand, stay on the phone to someone, make up a fake phone call because my heart is going 100mph in fear of being assaulted, followed, harassed and... MURDERED. ",Positive,OFF,Negative,#MeToo,
91,"Police officer 'failed to investigate' murder victim's reports of #DomesticAbuse. Linda Vilika made reports to the police about her husband threatening her. 8 days later, her husband murdered her. The police officer has just been given a written warning.",Positive,OFF,Negative,#DomesticAbuse,
92,"""He controlled what I wore, what I ate and drank, who I saw, who I spoke to, my social media, my telephone, our bank accounts, my credit card. He controlled how much sleep I had."" — Survivor of #EconomicAbuse.",Positive,OFF,Negative,#DomesticAbuse #EconomicAbuse,
93,"Plasterer fixes homes of #domesticabuse survivors for free. Naima Ben-Moussa has crowdfunded thousands of pounds to pay for life-changing renovations. Having suffered abuse as a child, she said she ""understood"" what victims had gone through.",Negative,NOT,Positive,#domesticabuse,
94,"Public memory especially among #Kashmiri people tends to be fragile. It is easier to forget than to remember .We might choose to push the memories into dark corners of our mind, but the survivors have no choice. It can be me, you , our  sisters, mothers anybody.  #DomesticAbuse",negative,OFF,Neutral,#DomesticAbuse,
95,"Many children who are repeatedly abused sexually may have no clear memory of these experiences, while some may prefer not to remember. Denial, dissociation, and repression allow children to go on living life with the illusion of normalcy,  Down pointing backhand index #rape #sexualabuse #mentalhealth",Negative,OFF,Neutral,#rape #sexualabuse #mentalhealth,
96,"At 13, I was enslaved by my uncle. Now, I make sure survivors of modern slavery get a voice - Sophie Otiende Kenyan teacher, feminist, and human trafficking survivor advocate.",Positive,OFF,Negative,#sexualabuse,
