uid,Text,DV_present,Abuse_present,Sentiment,Hashtags,
97,"All my life, I have lived in a big, joint family. When I was a little child around 6 or 7 year old,I used to live with my paternal grandparents and I was very close to my grandpa.We used to play a lot of games together. He would also read me stories and bring me gifts. One day something happened which changed our relationship altogether.I was sitting there with him watching movie and he tried to glide his hands under my top and said that he wanted to kiss my breast.I was 6 and I didn’t understand any of it and I took it all in a good way and let him do that. He grabbed my breast and sat there for like 10-15 mins and asked me to not tell anyone about this.",Positive,OFF,Negative,#ChildSexualAbuse #Abuse #Childhood #ChildhoodStories #DysfunctionalFamily,
98,Yesterday a #customer told me he felt like I raped him because he had to pay $3 for a loaf of bread. I can't stop thinking about how trivial men think rape is. This hurt me. I tried to pass it off as a joke but it keeps running through my head. #retailproblems #rapesurvivor,Positive,OFF,Neutral,#rapesurvivor,
99,"I feel the internal scars of psychological abuse are worse & longer lasting than the physical. There needs to be mandatory training in #DomesticAbuse & #coercivecontrol by all involved in FC from the GALs to “experts” SW’s, lawyers etc or abusers will continue to get away with it",Negative,OFF,Neutral,#DomesticViolence,
100,I’ve been hit by the rugby bus! Haven’t felt this sore in a while #beatenup #wrugby #physical #bumps #bruises lazy Sunday is needed,Negative,NOT,Neutral,#wrugby #physical #bumps #bruises #beatenup ,
101,"When women come to our refuges they feel guilty for ""what they're putting their kids through"". We work with them so they put the blame where it belongs, solely with the perpetrator of the abuse. #maleviolenceagainstwomen",Negative,OFF,Neutral,#maleviolenceagainstwomen,
102,"Women are blamed by the system for ""failing to protect"". Blamed by society for ""not leaving"". Its no wonder they feel misplaced guilt. Our specialist staff help them to understand it's not their fault. #domesticabuse",Negative,NOT,Negative,#domesticabuse,
103,"TW FOR DOMESTIC VIOLENCE want to give the biggest shoutout to my bff. My mother is a survivor of domestic violence. watching her get hit, black and blue.. permanent knee damage etc haunts me till this day, but not her. She’s the strongest woman I’ve ever met. I love you 4L #DVAM",Positive,OFF,Neutral,#DVAM,
104,#DVAM I’m a domestic abuse survivor. This means a lot to me. Trump has removed our protections. It endangers us. We deserve to feel safe. Please #VoteBiden #VoteEarly #VOTE #VoteBidenHarrisToSaveAmerica,Positive,NOT,Neutral,#DVAM #VoteBiden #VoteEarly #VOTE #VoteBidenHarrisToSaveAmerica,
105,Domestic violence victims are not ‘weak’ ‘trauma-bonded’ and ‘codependent’ - they are strong women appeasing their abuser while intelligently plotting a way to safety for themselves and their children all while being very aware of the risk they are facing #DVAM #respectsurvivors,Negative,NOT,Neutral,#DVAM #respectsurvivors,
106,"So many messages about domestic violence survivors are insulting - like they are just lovesick, spineless, and ignorant. They are not. Honor and respect survivor’s strengths, courage, intelligence, and the lengths they will go to protect their children.  #dvam #DVAM2020",Negative,NOT,Neutral,#dvam #DVAM2020,
107,"1 in 10 high school students has been purposefully hit, slapped or physically hurt by a boyfriend or girlfriend. #youngerthanyouthink #1thing #domesticviolence #datingviolence #sexualassault #sexualabuse #stalking #DVAM",Positive,OFF,Negative,#youngerthanyouthink #1thing #domesticviolence #datingviolence #sexualassault #sexualabuse #stalking #DVAM,
108,"4 in 10 young Australian men do not consider punching & hitting to constitute domestic violence, a survey finds. A similar proportion does not classify non-consensual sexual activity, degrading a person or isolating them from their friends as #DV. ",Positive,OFF,Negative,#DV #DVAM,
109,"The actions survivors of abuse take to survive and defend themselves often lead to criminalization. Their experience of domestic violence is often diminished, being viewed as a criminal to be punished instead of a survivor to be supported.#DVAM",Negative,NOT,Neutral,#DVAM,
110,"Abusive relationships often involve violence, isolation, fear and threats. These relationships often make you feel unsafe. Remember to reach out to emergency services if needed #DVAM #loveisrespect #TitleIXThursday",Positive,OFF,Negative,#DVAM #loveisrespect #TitleIXThursday,
111,"Unhealthy relationships begin to break down through lack of trust, support and respect of boundaries. Unhealthy relationships have the potential to turn abusive #DVAM #loveisrespect #TitleIXThursday",Negative,OFF,Negative, #DVAM #loveisrespect #TitleIXThursday,
112,"Dating violence is a pattern of coercive, intimidating, or manipulative behaviors used to exert power and control over another #DVAM #loveisrespect #TitleIXThursday",Positive,OFF,Negative,#DVAM #loveisrespect #TitleIXThursday,
113,"Dating violence is more common than people think it can include: physical, financial, emotional, verbal, and sexual abuse. In addition to digital abuse (use of technology like cellular devices and social media to abuse and control another) #DVAM #loveisrespect #TitleIXThursday",Positive,OFF,Negative,#DVAM #loveisrespect #TitleIXThursday,
114,"With DV awareness month ending, here’s a reminder that we should be just as attentive in every other month. Know the warning signs for urself and friends. Abusers come in all shapes and sizes. And just because they don’t have bruises, doesn’t mean they’re not being abused. #DVAM",Positive,OFF,Negative,#DVAM,
115,"""10 ago my husband said if I divorced him, he’d take custody of our kids + use my sexuality against me in court. His words paralyzed me, which is exactly the power of #CoerciveControl. ""We do not 'choose' to stay. ""We think we have no choice."" #DVAM",Positive,OFF,Negative,#DVAM,
116,"Sisters, a friendly reminder for life: immediately leave any man who thinks he owns your mind, body or your vote or uses religion to become your master in ANY WAY. Leave his stupid ass, you deserve better. Need Help? http://800.799.SAFE (7233). #DVAM",Negative,NOT,Neutral,#DVAM,
117,"“I don't think there is anything particularly wrong in hitting a woman, though I don't recommend you do it the same way that you hit a man.”- Sean Connery",Negative,NOT,Negative,,
118,"""An open-handed slap is justified – if all other alternatives fail and there has been plenty of warning. If a woman is a bitch, or hysterical, or bloody-minded continually, then I'd do it."" - Sean Connery",Positive,OFF,Negative,,
119,"""There are women who take it to the wire. That's what they are looking for, the ultimate confrontation. They want a smack."" - Sean Connery",Negative,OFF,Negative,,
120,It’s only fitting that #seanconnery should die on the last day of Domestic Violence Awareness Month. Let his death serve the interests of the the class of people he so disrespected. #women #dvam #DomesticViolence,Negative,NOT,Negative,#women #dvam #DomesticViolence,
121,"At seventeen, I got out of an abusive relationship. I want to say I haven’t looked back- but I have. It took a break up for me to realize what I had endured- emotional abuse. It’s taken time to heal. I’m still healing every day. But I have help and #YouveGotHelp too. Reach out",Positive,NOT,Negative,#YouveGotHelp,
122,"When we start to talk about the abuses we've been silently stewing in for generations, a language emerges - words & concepts to express what our instincts have been telling us. We gain power.",Positive,NOT,Negative,,
124,"One thing I needed to hear when I finally opened up about my abuse was that it wasn’t my fault. That I didn’t “let it happen to me.” I am smart, kind and caring. He used my kindness against me, he manipulated me daily - but it wasn’t my fault. #YouveGotHelp",Positive,NOT,Negative,#YouveGotHelp,
125,"Do you understand how detrimental that was to my mental health? How scared I was to trust again after? I just assumed it would always happen, after all I make good people do bad things. It took YEARS to break that train of thought and some days it lingers back in. #YouveGotHelp",Positive,NOT,Negative,#YouveGotHelp,
126,"Abusers tend to be very manipulative and come off as charming to everyone else. Mine convinced me that I was just crazy, that he wasn’t actually abusive and that I was “damaging his reputation.” He wanted me to believe I was in the wrong #Youvegothelp",Positive,NOT,Negative,#Youvegothelp,
127,"This is important. Just because it isn’t physical doesn’t mean it isn’t abuse. My personal experience was emotional/financial abuse that lasted for over a year. When I finally left, it was another six months and a court date until I was free. #YouveGotHelp, just reach out.",Positive,NOT,Negative,#Youvegothelp,
128,"I left my abusive relationship almost three years ago; at the time he completely isolated me from all my friends and family BUT when I finally left, my friends and family were waiting with open arms to help me pick up the pieces. Please remember #Youvegothelp",Positive,NOT,Positive,#Youvegothelp,
129,"This cycle is so real. The fearing for the outburst, the outburst (emotional, physical, verbal) and then the pleading they’ll be better and buying you nice things or taking you out to make up for it",Positive,NOT,Negative,,
130,"By the point of the first outburst you’re usually deep in it and conditioned by your abuser. Their manipulation tactics play on your mind and you believe you have to stay - out of commitment, out of embarrassment, or out of fear. #YouveGotHelp",Positive,NOT,Negative,#YouveGotHelp,
131,"Because even in that moment I felt I was NOT ALLOWED to claim that as an emergency. 911 immediately transferred me off the emergency line. I wish I’d recorded or remembered my wait time. It was long. It was over an hour, I know that. I don’t think it was over two hours.",Positive,OFF,Negative,,
132,"-The torment just kept going on an on an on, Isiah was getting his rocks off as I lay on my stomach, silent tears an prayers going through my head all wishing he’d stop….an he did, eventually.",Positive,OFF,Negative,#Solo #TriggerWarnings #DV #SexualAssault,
133,A San Antonio officer shot and killed a man accused of threatening his wife and her three children with a knife,Positive,OFF,Negative,,
134,Walking away on a #relationship or #marriage that is #abusive isn't #givingup -- It's finally giving yourself a fighting chance at #happiness #love and #health. Don't seek permission to leave. . .,Positive,NOT,Neutral,#domesticviolence #datingviolence #spousalabuse #narcissisticabuse,
135,"TBH, Abuse isn’t only physical, there are many tactics of abuse. Digital abuse happens when your partner constantly texts or calls you or uses apps to track you. Abuse is not love. #TeenDV #TeenDating #YoungLove #Datingviolence #Indigenous #Native #NativeLoveIs",Positive,NOT,Negative,#TeenDV #TeenDating #YoungLove #Datingviolence #Indigenous #Native #NativeLoveIs,
136,"""When I was 15, I went through an abusive relationship... and it took a long time to move past the anxiety..."" Listen to Leah's survivor story and how she pushed through her trauma from abuse. Thank you, Leah! https://youtu.be/WPX9IvQciwE #Datingabuse #TeenDV",Positive,NOT,Negative,#Datingabuse #TeenDV,
137,"Over 50% of men & women who have been physically or sexually abused or stalked by a dating partner, first experienced abuse between the ages of 11-24. #DVAM #1thing #domesticviolence #sexualabuse #datingviolence #relationshipviolence #youngerthanyouthink",Negative,NOT,Neutral,#DVAM #1thing #domesticviolence #sexualabuse #datingviolence #relationshipviolence #youngerthanyouthink,
138,"""One thing that made it so hard for me to leave was after he abused me he would always try to kill himself. It was another way to control me. He would take pills or do things to try to get me to save him from himself."" http://bit.ly/2ql8B3O #RawTruthDV #btsadv #DVAM2018",Positive,NOT,Negative,#RawTruthDV #btsadv #DVAM2018,
139,"""One night I told him I couldn’t be in the relationship anymore. He got the kids to sleep, took me in the bedroom, put me on the floor and raped me while holding a knife to my neck. He told me it was time for me to die."" http://bit.ly/2ObwFQl #RawTruthDV #btsadv #DVAM2018",Positive,OFF,Negative,#RawTruthDV #btsadv #DVAM2018,
140,I’m glad we’re starting to discuss forms of emotional and psychological abuse now because a lot of folks you know use “I never put my hands on anyone” as cover for the fact that they’ve been manipulative partners who coerce and gaslight. #DVAM2018,Positive,NOT,Negative,#DVAM2018,
141,"Domestic violence is about control and control takes many many forms. If a partner is ""only"" controlling through technology it is still not okay. We all deserve to be safe in every way #DVAM2018",Positive,NOT,Neutral,#DVAM2018,
142,"""My children were in the car, and he assaulted me, grabbed the steering, and tried to run us off the road. My daughter was smart enough to call the police and give them mile markers to where we were on the highway."" http://bit.ly/2EP8NT0 #RawTruthDV #btsadv #DVAM2018",Positive,OFF,Negative,#RawTruthDV #btsadv #DVAM2018,
143,"“This cuts across every economic level. Any race, any religion, any ethnicity, any age. It has to do with power and how one person exerts control over another person. Finances are an invisible weapon.” #DVAM2018 @PurplePurse https://buff.ly/2JoKz0y",Negative,NOT,Neutral,#DVAM2018 ,
144," am the daughter of a narcissist. When I think about domestic violence, two people come to mind: my father, and Kevin, the son of a family friend. Because of that awful period in my life, I have no faith or trust in my father. #btsadv #dvam2018 http://bit.ly/2PtzkJK",Negative,NOT,Negative,#btsadv #dvam2018,
145,"""The idea of what happens at home, stays at home, killed my sister."" - @JanineAuthor recounting the murder of her sister Amy, at hands of Amy's boyfriend. #SU4SF #domesticviolence #DVAM2018",Positive,NOT,Neutral,#domesticviolence #DVAM2018,
146,Tonight in #BreeseIl #ButterflyDreamsAlliance is holding a candlelight vigil for #DVAM2018 - CDC est 1 in 4 homes living with some type of violence or harm. Youth Risk survey reports 1 in 3 teens have been physically/sexually harmed by someone they're dating. 6pm #IgniteChurch,Positive,NOT,Negative,#BreeseIl #ButterflyDreamsAlliance #DVAM2018 #IgniteChurch,
147,A high conflict ex spouse may be the perpetrator of #abuse. She may attempt to control everything the new spouse or SO does and engage in harassing behavior. DV isn’t always between intimate partners. #DVAM2018,Negative,OFF,Negative,#DVAM2018,
148,"He's an abuser Abusers R verbally/emotionally abusive: Verbal abuse often starts long before any physical battering. Name-calling, yelling, blaming, swearing, or making insulting gestures R all warning signs of imminent physical abuse. #DVAM2018  #DomesticViolenceAwarenessMonth",Positive,OFF,Negative,"#DVAM2018 
#DomesticViolenceAwarenessMonth",
149,"2/3 of #elderabuse victims are women.  Older women who experience #domesticviolence often overlooked- need to tailor resources to fit their needs. It is DV when a family member abuses, exploits an older relative. #DVAM2018 @NOMOREorg @ncall_us @TheJHF",Negative,NOT,Neutral,#domesticviolence #DVAM2018,
150,"A survivor letter to an abuser: ""I’m still scared sometimes. I still look over my shoulder. I feel like you’re still watching me, judging my every move. Waiting for the perfect time to reappear and finish what you started."" http://bit.ly/2Sq1bt3 #RawTruthDV #btsadv #DVAM2018",Positive,OFF,Negative,#DVAM2018,
151,"“Something was just telling me, ‘You’ve had enough.'” After bravely leaving an abusive relationship, Isis and her two sons were at risk for #homelessness.  S:US helped them stay safe, heal, and build a healthy future together. #DVAM2018",Positive,OFF,Negative,#homelessness #DVAM2018,
152,"As #DVAM2018 is nearing its end, I wanted to share my personal story about domestic violence & how I escaped https://narcissisticabuse.blog/2018/06/27/my-victim-impact-statement-to-my-narcissistic-ex-boyfriend/… #domesticviolence #domesticabuse #narcissisticabuse #ptsd #cptsd #healing #trauma #victim #survivor",Positive,NOT,Neutral,#DVAM2018 #domesticviolence #domesticabuse #narcissisticabuse #ptsd #cptsd #healing #trauma #victim #survivor,
153,"The term 'revenge porn' or more accurate term nonconsensual pornography, is a common threat and tactic within abusive relationships.  @CCRInitiative has created online removal guides: https://cybercivilrights.org/online-removal/?fbclid=IwAR2UcO6FbdlX6HFHVZFupHMY9SCGyccDQdUGw-vvKdZyC9y1CuN8PmWvtPk… #DVAM2018",Positive,OFF,Negative,#DVAM2018,
154,Abusers or batterers just have a problem expressing anger. They need counseling or anger management courses to learn to resolve disputes without violence #mythmonday #DVAM2018,Positive,OFF,Negative,"#mythmonday
#DVAM2018",
155,BC when a #SurvivorSpeaks others have the courage to be heard. Stacy* tells us about what it felt like to hear others who had similar experiences to hers & the strength that gave her to reach out for help herself. #DVAM2018,Negative,NOT,Neutral,"#SurvivorSpeaks
#DVAM2018",
156,BC when a #SurvivorSpeaks we get a better idea of what control tactics look like. Patricia* tells about the text messages she would receive from her abuser demanding to know where she was. She says the impact on her schooling & work was overwhelming. #DVAM2018,Negative,NOT,Neutral,"#SurvivorSpeaks
#DVAM2018",
157,"BC when a #SurvivorSpeaks we’re reminded of how important support of friends and family can be. Colleen* explains how important it was that her mom & grandparents never gave up on her, stepping in w support & love at every chance until she was finally away from him.
#DVAM2018",Negative,NOT,Neutral,,
158,"Nearly three in four survivors of intimate partner violence stayed with an abusive partner longer than they wanted or returned to them for economic reasons, according to new @IWPResearch report. #paidsickdays #DVAM2018 http://bit.ly/2qdNHU9",Positive,OFF,Negative,#paidsickdays #DVAM2018,
159,"There are different types of partner abuse. Oftentimes, abusers will use finances to harm a person’s financial stability or discourage them from getting help. Learn the different forms of abuse: …https://www.centerforabusedpersonscharlescounty.org/intimate-partner-violence…  #DVAM2018",Positive,OFF,Negative,#DVAM2018,
160,"""He got my mother and stepfather to take his side and gang up on me, threatening to take my daughter away forever if I left and insisting that I have some kind of mental disorder."" http://bit.ly/2Q1V4JL #RawTruthDV #btsadv #DVAM2018",Positive,OFF,Negative,#DVAM2018,
161,"Did you know that college roommates could have an abusive relationship? #Abusers may go after anyone in their path...including roommates. The abuser wants power and control. If your roommate is abusive, tell your RA. #DVAM2018 https://thoughtco.com/signs-of-a-bad-roommate-relationship-793696",Positive,OFF,Negative,#DVAM2018,
162,"An example of coercive control is an #abuser yelling, screaming and physically threatening a victim if she didn’t buy drinks for a dinner party in order to force her to do it “or else.” #DVAM2018",Positive,OFF,Negative,#abusers #DVAM2018,
163,#Abusers don’t accept accountability for their actions. They tell the victim “we need to stop treat each other this way” “you know how to keep me from acting like this” or “you are turning me into a monster.” Their actions are the victim’s fault. #DVAM2018,Positive,OFF,Negative,#abusers #DVAM2018,
164,"In #DVAM2018 and every month it is important to remember that domestic abuse is not always physical. Emotional abuse can be just as serious as physical, and is not always discussed. To gain more insight read this article: https://bit.ly/2pqkwg5",Positive,NOT,Negative,#DVAM2018,
165,"""I told him I was calling the police. He ripped his shirt and began to punch himself in the head. I didn’t know why at the time, but he was already planning to claim self-defense."" http://bit.ly/2JeSUnw #RawTruthDV #btsadv #DVAM2018",Positive,OFF,Negative,#DVAM2018,
166,#Abusers antagonize victims until the victim becomes angry or upset and then say “see...she is the problem.” #DVAM2018,Positive,OFF,Negative,#abusers #DVAM2018,
167,"""I was cheated on and blamed. I was kept isolated from finances. I was forced into abortions I didn’t want, and I was used sexually because I was married; my feelings of disgust didn’t matter.""  http://bit.ly/2PlvKRT #RawTruthDV #btsadv #DVAM2018",Positive,OFF,Negative,#RawTruthDV #btsadv #DVAM2018,
168,#Gaslighting is psychological abuse whereby victim is lied to about almost anything. #abuser often finds behavior funny or tries to make victim seem stupid/crazy. It can be especially damaging when victim is isolated. It’s about power and control. #DVAM2018,Positive,OFF,Negative,#Gaslighting #DVAM2018,
169,"""There is a very real fear that my mother’s murder will be blamed on our culture and faith rather than on a culture of patriarchy and violence .""  @NourNaas #DVAM2018",Negative,OFF,Neutral,#DVAM2018,
170,"""Earlier that day we had vowed our lives to each other. In good times and bad, through sickness and health. That very night was the first time my abuser ever laid his hands on me."" http://bit.ly/2CyZl3D #RawTruthDV #btsadv #DVAM2018",Positive,OFF,Negative,#DVAM2018,
171,"""Once you have decided to leave and the abuser suspects what you are doing, they will become even more controlling, violent and abusive.”~CL Valens http://bit.ly/domesticviolencesurvivorhandbook… #DVAM #DVAM2018 #domesticviolence #domesticabuse #metoo #DVHelper #DVSurvivor #allgenders #childrensuffer",Positive,OFF,Negative,#DVHelper #DVSurvivor #allgenders #childrensuffer,
172,"An apology from a narcissist:
""I apologize for how I spoke to, but you need to learn respect and how to communicate with people, I do as well, but you already know the way I get when I'm angry and you kept going so and didn't let me finish speaking once, I said ... ""
#DVAM2018",Negative,OFF,Neutral,#DVAM2018,
173,"Does anyone else find the @SafeHorizon #putthenailinit campaign just a little too - I don't know - aggressive? Like, why use an analogy about death when so many women are killed by abusers? I don't know, maybe it's just me.  Am I reaching or does it feel gross to you, too?",Negative,OFF,Negative,#putthenailinit,
174,"A moving personal story from Dr. Conte Terrell founder of Fresh Spirit Wellness. 

“It did not look like what I thought abuse looked like. And it didn’t happen every day or every week.” 

Domestic violence happens to 1 in 4 women, every 9 seconds. 

#DVAM2018 #socialjusticeUH",Positive,NOT,Neutral,#DVAM2018,
175,"""#1Thing that most impacted my healing & resilience is understanding the connection of trials of my life & how those trials affected every decision I have made."" - Tonise Gardner #DVAM2018",Negative,NOT,Positive,#1Thing #DVAM2018,
176,"AVDA’s Maisha Colter explains that abusive relationships generally seem to begin as loving relationships, but the abuser begins to use control and power over his/her partner. “Break the Silence” 
@HarrisCountyDAO
@UHouston
 #DVAM2018",Positive,OFF,Negative,#DVAM2018,
177,"Largely female, often poor, domestic violence victims suffer in silence and live in the shadows. In our 
@BarrowNeuro
 clinic, we see increasing numbers of domestic violence victims who have suffered too many traumatic brain injuries to count. #DVAM2018",Positive,NOT,Negative,#DVAM2018,
178,"Domestic violence is the third chapter in the unfolding history of #concussion.
First chapter involved Gulf War vets.
Second chapter was pro athletes.
Now we are identifying a growing number of traumatic brain injuries in domestic violence victims. #DVAM2018",Negative,OFF,Neutral,#DVAM2018,
179,People often think of domestic violence as physical harm. But emotional abuse among partners can be just as damaging. #DVAM2018,Positive,NOT,Negative,#DVAM2018,
180,"“Well, why doesn’t she just leave?”

Because she can’t afford to.

ON OUR BLOG: Economic Sabotage and Exploitation in Abusive Relationships http://bit.ly/2PhAtEn #financialabuse #DVAM #DVAM2018",Negative,NOT,Neutral,#financialabuse #DVAM #DVAM2018,
181,"Domestic violence is the leading cause of injury to women - more than car accidents, muggings, and rapes combined. 
#factfriday
#DVAM2018",Negative,NOT,Neutral,#DVAM2018,
182,No one should have to decide between housing and living with abuse. #EndDV #DVAM2018,Negative,NOT,Neutral,#EndDV #DVAM2018,
183,"""Due to the financial instability abusers impose on their partners, many victims, especially those with children, feel like they can't flee for safety."" Financial abuse is an aspect of domestic violence that still needs more attention. 
#DVAM #DVAM2018 ",Positive,OFF,Neutral,#DVAM #DVAM2018,
184,"#DVAM2018 Day 26. #IPV is about power and control. So is demagoguery. So is fear-mongering. Many abusers have narrow notions of gender roles, and respond to shame with anger and violence. Today, couldn't help but notice.",Positive,OFF,Negative,#DVAM2018 #IPV,
185,"""As a fellow indigenous person, I also believed, like many native women I know, it was my job to protect you from state violence."" #DVAM2018 TW: domestic violence, abuse https://theestablishment.co/a-letter-to-my-abuser-ff705dfec5cc/",Negative,NOT,Neutral,#DVAM2018,
